{
  "version": "1",
  "status": "published",
  "registration_id": "reg_01jzinstancebootstrap",
  "conversation_id": "conv_01jzinstancebootstrap",
  "agent_id": "0x1111111111111111111111111111111111111111111111111111111111111111",
  "agent": {
    "agent_id": "0x1111111111111111111111111111111111111111111111111111111111111111",
    "domain": "demo.greater.website",
    "local_id": "oracle",
    "authority_model": "instance_trust",
    "capabilities": ["chat", "email"],
    "self_description_version": 1,
    "lifecycle_status": "active",
    "status": "active",
    "policy_version": "hosted-bound-soul/v1",
    "anchor_state": "hosted_offchain",
    "operational_binding": "hosted_bound_soul",
    "capability_policy_version": "capability-policy/v1",
    "caller_access_payment_policy_version": "caller-access-payment/v1",
    "email_default_allowed": true,
    "phone_entitlement_status": "not_entitled",
    "sms_allowed": false,
    "voice_allowed": false,
    "public_paid_caller_access": "denied",
    "policy_migration_state": "persisted_v1",
    "updated_at": "2026-06-12T16:35:00Z"
  },
  "published_version": 1,
  "published_at": "2026-06-12T16:35:00Z",
  "publication": {
    "agent_id": "0x1111111111111111111111111111111111111111111111111111111111111111",
    "published_version": 1,
    "registration_uri": "s3://lesser-host-lab-soul-packs/registry/v1/agents/0x1111111111111111111111111111111111111111111111111111111111111111/registration.json",
    "registration_s3_key": "registry/v1/agents/0x1111111111111111111111111111111111111111111111111111111111111111/registration.json",
    "versioned_registration_uri": "s3://lesser-host-lab-soul-packs/registry/v1/agents/0x1111111111111111111111111111111111111111111111111111111111111111/versions/1/registration.json",
    "versioned_registration_s3_key": "registry/v1/agents/0x1111111111111111111111111111111111111111111111111111111111111111/versions/1/registration.json",
    "authority_model": "instance_trust",
    "anchor_state": "hosted_offchain",
    "published_at": "2026-06-12T16:35:00Z"
  },
  "promotion": {
    "agent_id": "0x1111111111111111111111111111111111111111111111111111111111111111",
    "registration_id": "reg_01jzinstancebootstrap",
    "stage": "graduated",
    "request_status": "graduated",
    "review_status": "published",
    "readiness_status": "graduated",
    "authority_model": "instance_trust",
    "anchor_state": "hosted_offchain",
    "latest_conversation_id": "conv_01jzinstancebootstrap",
    "latest_conversation_status": "published",
    "published_version": 1,
    "graduated_at": "2026-06-12T16:35:00Z"
  }
}
